part_number,description
71140-TLA-A00,"Part Number: 71140-TLA-A00  
Name: COR UP BEAM R FR  
Application: Honda Civic, 2019  
Condition: New  
Technical Specs: Genuine OEM part, designed for optimal performance, made from high-quality materials, ensures structural integrity and precision fit.  
Fitment Details: Specifically fits the Right Front Corner Upper Beam of the 2019 Honda Civic; direct replacement for the factory-installed part.  
Notable Features: Engineered to meet strict OEM quality standards, guarantees compatibility and longevity, retains original factory design elements for seamless integration.  "
71140-TR0-A00,"Part Number: 71140-TR0-A00  
Name: UP BEAM COMP R FR  
Application: Honda CR-Z (2013-2016), Clarity (2017-2018), Odyssey (2014-2017)  
Condition: New  
Technical Specs: Genuine OEM part, designed for optimal fit and function, delivering precise alignment and structural integrity.  
Fitment Details: Compatible with specified Honda models within the listed year range; ensures proper installation and performance.  
Notable Features: Manufactured to Honda's strict quality standards, this component guarantees durability and reliability for your vehicle's front end."
71150-TBA-A00,"Part Number: 71150-TBA-A00  
Name: UP BEAM COMP FR B  
Application: Honda Civic, Element, Passport (2022)  
Condition: New  
Technical Specs: OEM quality, designed for superior fitment and performance, engineered to meet factory specifications.  
Fitment Details: Directly replaces original equipment for 2022 Honda models listed, ensuring optimal integration with existing components.  
Notable Features: Original Honda part, new in packaging, ensures reliability and longevity, assists in maintaining structural integrity of the vehicle."
71150-TLA-A00,"Part Number: 71150-TLA-A00  
Name: EXTN COMP R FR BP  
Application: Honda Fit (2018)  
Condition: New  
Technical Specs: Genuine OEM part, designed for optimal performance, Direct fit replacement.  
Fitment Details: Specifically engineered for 2018 Honda Fit models to ensure compatibility and seamless installation.  
Notable Features: Manufactured for superior durability, precision fitment, and enhanced vehicle aesthetics. Ensures adherence to Honda's quality standards for reliable safety and functionality."
71151-T21-A00,"Part Number: 71151-T21-A00  
Name: LWR GRILLE FR BPR  
Application: Honda Civic, Fit, Odyssey (2014-2019)  
Condition: New  
Technical Specs: Genuine OEM part; made of high-quality plastic; color-matched to factory specifications.  
Fitment Details: Designed to directly replace the original lower front grille on specified models without modifications.  
Notable Features: Engineered for optimal airflow and aesthetic integration, ensuring a perfect fit and finish that meets Honda’s quality standards. Ideal for restoring or upgrading your vehicle's front-end appearance."
71166-TLA-A00,"Part Number: 71166-TLA-A00  
Name: BRKT L FR FOG  
Application: Honda Passport (2012-2023)  
Condition: New  
Technical Specs: OEM design, durable construction, exact fitment specifications.  
Fitment Details: Designed specifically for the left front fog light installation on Honda Passport models from 2012 to 2023.  
Notable Features: Genuine Honda part ensures optimal performance and compatibility, maintaining original equipment standards for safety and aesthetics."
71170-T20-A00,"Part Number: 71170-T20-A00  
Name: SAFETY PLATE ASSY  
Application: Honda Civic, HR-V, Insight, Passport (2022)  
Condition: New  
Technical Specs: Genuine OEM part, designed for optimal fit and performance, meets strict Honda quality standards.  
Fitment Details: Direct fit for 2022 models; ensures proper installation and functionality.  
Notable Features: Enhances safety mechanisms; manufactured with durable materials for longevity and reliability."
71170-TR3-A50,"Part Number: 71170-TR3-A50  
Name: ABS FR BUMPER  
Application: Honda Civic, HR-V, Insight (2013)  
Condition: New  
Technical Specs: Made from high-quality ABS plastic, precision-molded for optimal fit and durability.  
Fitment Details: Designed specifically for the 2013 models of Honda Civic, HR-V, and Insight; ensures factory-like installation.  
Notable Features: Lightweight design with enhanced resistance to impact; finished in OEM color for seamless integration with vehicle aesthetics.  

Limited quantity available."
71173-TLA-A00,"Part Number: 71173-TLA-A00  
Name: MLDG B L FR GRILL  
Application: Honda Accord (2013)  
Condition: New  
Technical Specs: Genuine OEM part, high-quality plastic construction, measures XxYxZ dimensions (if applicable).  
Fitment Details: Direct fit for 2013 Honda Accord models; pre-drilled holes for easy installation  
Notable Features: Designed for optimal airflow and aesthetics, ensures perfect alignment with factory specifications, enhances the vehicle’s front-end appearance."
71175-T20-A00,"Part Number: 71175-T20-A00  
Name: SAFETY PLATE FR B  
Application: Honda Ridgeline (2010-2018)  
Condition: New  
Technical Specs: OEM quality, designed for precise fit and optimal performance; dimensions comply with manufacturer standards.  
Fitment Details: Compatible with all Honda Ridgeline models from 2010 to 2018, ensuring proper installation and functionality.  
Notable Features: Genuine Honda part, ensuring reliability and safety; comes in original packaging for assurance of authenticity."
71180-TLA-A60,"Part Number: 71180-TLA-A60  
Name: UPR GARN ASSY R F  
Application: Honda Accord, Fit, Insight (2017)  
Condition: New  
Technical Specs: Genuine OEM part, original packaging, dimensions tailored for specific models.  
Fitment Details: Designed to fit 2017 Honda Accord, Fit, and Insight; ensures precise installation and optimal performance.  
Notable Features: Incorporates advanced materials for enhanced durability, UV resistance, and a factory-finish appearance that aligns perfectly with Honda standards."
71185-TLA-A60,"Part Number: 71185-TLA-A60  
Name: UPR GARN ASSY L F  
Application: Honda Ridgeline (2013-2020)  
Condition: New  
Technical Specs: Genuine OEM part; includes original packaging; designed for effective water drainage and debris protection.  
Fitment Details: Compatible with Honda Ridgeline models from 2013 through 2020, ensuring a precise and secure fit to maintain vehicle integrity.  
Notable Features: Durable construction for long-lasting performance; specifically engineered to match factory specifications for optimal functionality and aesthetics."
71190-TBA-A00,"Part Number: 71190-TBA-A00  
Name: UP BEAM L FR BPR  
Application: Honda CR-V, Element (2020)  
Condition: New  
Technical Specs: Genuine Honda OEM part, designed for optimal performance and fit.  
Fitment Details: Direct replacement for the left front bumper beam on Honda CR-V and Element models, ensuring precise installation.  
Notable Features: Manufactured to OEM specifications, providing superior durability and safety standards, includes original packaging for authenticity. 

This part is crucial for maintaining structural integrity and aesthetics in your vehicle's bumper system."
71190-TLA-A00,"Part Number: 71190-TLA-A00  
Name: COR UP BEAM L FR  
Application: Honda CR-Z, Fit, Insight, Ridgeline (2013)  
Condition: New  
Technical Specs: OEM specification, genuine Honda parts, designed for optimal fit and performance.  
Fitment Details: Specifically designed for 2013 Honda CR-Z, Fit, Insight, and Ridgeline models, ensuring precise alignment and functionality.  
Notable Features: Constructed with high-quality materials for durability; includes original packaging, maintained integrity for guaranteed performance and reliability."
71193-SZA-A00,"Part Number: 71193-SZA-A00  
Name: SPACER R FR BPR S  
Application: Honda HR-V (2016-2019)  
Condition: New  
Technical Specs: OEM genuine part, constructed from high-quality materials for durability.  
Fitment Details: Designed specifically for the right front bumper of Honda HR-V models from 2016 to 2019.  
Notable Features: Ensures precise alignment and fit for optimal performance, contributing to the overall integrity of the vehicle’s front-end assembly."
71193-T0A-A01,"Part Number: 71193-T0A-A01  
Name: SPACER R FR BPR S  
Application: Honda Accord, 2020  
Condition: New  
Technical Specs: OEM specification, designed to fit specific mounting locations, ensuring precise alignment and secure performance.  
Fitment Details: Compatible exclusively with 2020 Honda Accord front bumper reinforcement system.  
Notable Features: Genuine Honda part offering superior durability and reliability compared to aftermarket alternatives, providing a perfect fit for optimal structural integrity."
71193-TBA-A00,"Part Number: 71193-TBA-A00  
Name: SPACER R FR BPR S  
Application: Honda CR-V, Odyssey, Passport (2010)  
Condition: New  
Technical Specs: Genuine OEM; dimensions suitable for front bumper reinforcement; high-strength plastic construction.  
Fitment Details: Designed for use in 2010 models of CR-V, Odyssey, and Passport; positions between bumper and body for optimal alignment.  
Notable Features: Original equipment manufacturer quality ensures perfect fit and long-lasting durability; enhances structural integrity of front bumper assembly.  "
71193-TG7-A00,"Part Number: 71193-TG7-A00  
Name: SPACER R FR BPR  
Application: Honda Accord, Fit, Insight (2017)  
Condition: New  
Technical Specs: Genuine OEM part; designed for front bumper applications.  
Fitment Details: Compatible with 2017 models of Honda Accord, Fit, and Insight.  
Notable Features: Manufactured to OEM specifications, ensuring precise fitment and reliable performance in front bumper installations; comes in original packaging."
71193-THR-A01,"Part Number: 71193-THR-A01  
Name: SPACER R FR BPR  
Application: Honda Clarity (2022)  
Condition: New  
Technical Specs: Genuine OEM, designed for optimal performance, durable plastic construction, precision-engineered dimensions.  
Fitment Details: Specifically designed for the front bumper assembly to ensure proper alignment and functionality in the 2022 Honda Clarity.  
Notable Features: Original equipment part ensuring reliable fit and performance, enhances bumper stability and aesthetics, backed by Honda's quality standards."
71193-TME-T01,"Part Number: 71193-TME-T01  
Name: SPACER R FR BPR S  
Application: Honda Accord, Element, Ridgeline, S2000 (2016-2022)  
Condition: New  
Technical Specs: Genuine OEM part; material: high-quality plastic; dimensions: standard OEM specifications.  
Fitment Details: Specifically designed for proper fitment in front brake pad assemblies of the specified Honda models.  
Notable Features: Ensures optimal braking performance and alignment; manufactured to Honda's exacting standards for durability and reliability."
71193-TR0-A01,"Part Number: 71193-TR0-A01  
Name: SPACER R FR BUMPE  
Application: Honda CR-Z, Element, S2000 (2016)  
Condition: New  
Technical Specs: Material: OEM-grade plastic; Dimensions: Specific to fitment requirements; OEM specifications met.  
Fitment Details: Designed to fit right front bumper assembly on specified models; ensures proper alignment and function.  
Notable Features: Genuine Honda part, ensuring optimal performance and durability; factory packaged for quality assurance."
71198-T0A-A01,"Part Number: 71198-T0A-A01  
Name: SPACER L FR BPR S  
Application: Honda Crosstour, Ridgeline (2019)  
Condition: New  
Technical Specs: Genuine OEM part; dimensions designed for optimal fitment; manufactured to strict OEM specifications.  
Fitment Details: Specifically engineered for 2019 Honda Crosstour and Ridgeline models.  
Notable Features: Ensures correct alignment and spacing for front bumper assembly, enhancing structural integrity and performance."
71198-T2A-A01,"Part Number: 71198-T2A-A01  
Name: SPACER L FR BUMPE  
Application: Honda CR-V (2011), Ridgeline (2011), S2000 (2011)  
Condition: New  
Technical Specs: OEM quality, dimensions optimized for fitment, made from durable materials  
Fitment Details: Designed specifically for front bumper installation on compatible Honda models from the year 2011  
Notable Features: Genuine Honda part in original packaging, ensuring reliability and performance, ideal for repairs or replacements to maintain OEM specifications."
71198-TBA-A00,"Part Number: 71198-TBA-A00  
Name: SPACER L FR BPR S  
Application: Honda Element (2011, 2012, 2013)  
Condition: New  
Technical Specs: Genuine OEM part; designed for precise fit and durability; material ensures resilience against wear.  
Fitment Details: Specifically engineered for front bumper support on the Honda Element; sold as a pair (2 units available).  
Notable Features: Retains original manufacturer specifications, ensuring optimal performance and compatibility with your vehicle's front-end assembly."
71198-TG7-A00,"Part Number: 71198-TG7-A00  
Name: SPACER L FR BPR  
Application: Honda Clarity, 2021-2022  
Condition: New  
Technical Specs: Genuine OEM part, designed for left front bumper application, durable construction for optimal performance.  
Fitment Details: Compatible with Honda Clarity models, ensuring proper installation and alignment with factory specifications.  
Notable Features: Engineered for superior fitment and stability, providing support and protection for front bumper components."
71198-THR-A01,"Part Number: 71198-THR-A01  
Name: SPACER L FR BPR  
Application: Honda Accord, CR-Z, Insight, Passport (2018)  
Condition: New  
Technical Specs: Genuine OEM, Material: durable plastic, Dimensions: specific to part design.  
Fitment Details: Designed for front bumper reinforcement alignment and stability in specified models.  
Notable Features: Ensures proper fit and function, contributing to structural integrity and safety in collision impacts."
71198-TME-T01,"Part Number: 71198-TME-T01  
Name: SPACER L FR BPR S  
Application: Honda Passport (2014-2021)  
Condition: New  
Technical Specs: Genuine OEM part, manufactured from high-quality materials, designed for durability and reliability.  
Fitment Details: Specifically designed for the left front bumper support of the Honda Passport models within the specified year range.  
Notable Features: Ensures precise fitment and optimal performance; replaces worn or damaged spacers to maintain structural integrity of the front bumper assembly."
71198-TR0-A01,"Part Number: 71198-TR0-A01  
Name: SPACER L FR BUMPE  
Application: Honda Odyssey, 2018-2020  
Condition: New  
Technical Specs: Genuine OEM part, high-quality plastic construction, lightweight design, dimensions tailored for precise fit.  
Fitment Details: Designed specifically for the front bumper assembly of the 2018-2020 Honda Odyssey.  
Notable Features: Ensures optimal alignment and stability of the front bumper, contributing to enhanced vehicle aerodynamics and aesthetics. Two units available."
71198-TVA-A01,"Part Number: 71198-TVA-A01  
Name: SPACER L FR BPR S  
Application: Honda Crosstour (2012-2015), Insight (2012-2014), Ridgeline (2012-2018), S2000 (2012-2016)  
Condition: New  
Technical Specs: Genuine OEM part, designed for reliability and fitment  
Fitment Details: Specifically engineered for the left front brake pad installation  
Notable Features: Manufactured to Honda specifications for optimal performance and longevity, ensuring correct alignment and support for brake components."
71200-T20-A01,"Part Number: 71200-T20-A01  
Name: GRILLE ASSY FRONT  
Application: Honda Accord (2011-2021)  
Condition: New  
Technical Specs: Genuine OEM part, constructed with high-quality materials for durability; designed to fit seamlessly with factory specifications.  
Fitment Details: Specifically engineered for Honda Accord models from 2011 to 2021; ensures proper alignment and secure attachment.  
Notable Features: Features a sleek design that enhances vehicle aesthetics and provides optimal airflow; factory finish for a perfect match with original body panels."
71202-T20-A01,"Part Number: 71202-T20-A01  
Name: BASE R FR GRILLE  
Application: Honda Fit, HR-V, Pilot (2018-2020)  
Condition: New  
Technical Specs: High-quality OEM construction, original packaging, durable plastic material  
Fitment Details: Direct replacement for damaged or missing front grille, fits seamlessly with OEM mounting points for Fit, HR-V, and Pilot models  
Notable Features: Engineered for perfect fit and finish, ensures optimal airflow and aesthetic integration with vehicle design."
71207-T20-A01,"Part Number: 71207-T20-A01  
Name: BASE L FR GRILLE  
Application: Honda Element, Fit, HR-V, Odyssey (2017)  
Condition: New  
Technical Specs: Original Equipment Manufacturer (OEM), plastic construction, factory specifications, provides front-end protection  
Fitment Details: Designed for 2017 Honda models including Element, Fit, HR-V, and Odyssey; direct fit replacement  
Notable Features: Genuine Honda part ensures perfect fit and finish, enhances vehicle aesthetics while offering durability against road elements."
71230-T20-A01,"Part Number: 71230-T20-A01  
Name: SPACER R FR BPR S  
Application: Honda Clarity, Fit, HR-V, Odyssey, Passport (2010)  
Condition: New  
Technical Specs: Genuine OEM part, high-quality plastic construction, dimensions specifically designed for structural integrity  
Fitment Details: Designed for front bumper reinforcement; fits specified Honda models from the year 2010  
Notable Features: Original packaging, ensuring part authenticity and compatibility; engineered for precise fitment to enhance vehicle performance and safety."
71232-T20-A00,"Part Number: 71232-T20-A00  
Name: SPACER R UPR GARN  
Application: Honda Accord, Civic, Pilot (2014)  
Condition: New  
Technical Specs: Genuine OEM part; designed for upper garnish installation; material: high-strength polymer; dimensions: precision-molded for optimal fit.  
Fitment Details: Specifically engineered to fit Honda models listed; replacement part ensures correct alignment and mounting.  
Notable Features: Original packaging ensures authenticity; steeply discounted price; designed for durability and long-lasting performance under normal driving conditions."
71240-T20-A00,"**Part Number:** 71240-T20-A00  
**Name:** COR UP BEAM R FR  
**Application:** Honda Accord, Clarity, HR-V, Insight, S2000 (2016-2022)  
**Condition:** New  
**Technical Specs:** Genuine OEM part; constructed to meet OEM standards for quality and fitment; lightweight design.  
**Fitment Details:** Compatible with Honda models listed; specifically fits the right front upper beam position.  
**Notable Features:** Original packaging ensures authenticity; designed for enhanced structural integrity and performance in collision applications."
71280-T20-A01,"Part Number: 71280-T20-A01  
Name: SPACER L FR BPR S  
Application: Honda Crosstour, Ridgeline, S2000 (2022)  
Condition: New  
Technical Specs: Genuine OEM part, crafted for precision fit; designed for front bumper reinforcement.  
Fitment Details: Compatible with 2022 Honda Crosstour, Ridgeline, and S2000; ensure model compatibility before installation.  
Notable Features: Original packaging, ensures high quality and reliability; designed to maintain structural integrity under various driving conditions."
71290-T20-A00,"Part Number: 71290-T20-A00  
Name: COR UP BEAM L FR  
Application: Honda Element, 2013-2016  
Condition: New  
Technical Specs: Genuine OEM part, original packaging, weight: 1.5 lbs, dimensions: 24” x 6” x 4”.  
Fitment Details: Designed specifically for the left front corner of 2013-2016 Honda Element models.  
Notable Features: Ensures perfect fit and function, made from high-quality materials for durability, and includes mounting hardware for straightforward installation."
71350-TLA-A01,"Part Number: 71350-TLA-A01  
Name: GRILLE ASSY AIR S  
Application: Honda Crosstour, Fit, Insight, Passport, Pilot (2018-2023)  
Condition: New  
Technical Specs: Genuine OEM part, designed for optimal airflow, constructed for durability, compatible with factory mounting points.  
Fitment Details: Direct fit for specified Honda models; replaces original grille assembly.  
Notable Features: Aerodynamically designed for improved performance, enhances vehicle aesthetics, and built to original manufacturer specifications for reliability and longevity."
71410-TBA-A51,"Part Number: 71410-TBA-A51  
Name: BULKHEAD ASSY FR  
Application: Honda Crosstour (2021, 2022)  
Condition: New  
Technical Specs: OEM bulkhead assembly, precision-engineered for structural integrity, made from high-quality materials for durability.  
Fitment Details: Direct fit for 2021-2022 Honda Crosstour models; replaces original equipment part number.  
Notable Features: Designed to restore vehicle safety and performance, ensuring optimal alignment and support."
71411-TLA-C52,"Part Number: 71411-TLA-C52  
Name: BULKHEAD FR  
Application: Honda Pilot (2015)  
Condition: New  
Technical Specs: Made from durable materials, designed for front structural integrity, weight: 5.3 lbs, dimensions: 21"" x 15"" x 3"".  
Fitment Details: Specifically engineered to fit the 2015 Honda Pilot; direct OEM replacement ensuring proper installation.  
Notable Features: Authentic Honda OEM part, ensuring optimal performance and reliability; comes in original packaging for quality assurance."
71501-T6Z-A10,"Part Number: 71501-T6Z-A10  
Name: FACE RR BUMPER  
Application: Honda Pilot (2013)  
Condition: New  
Technical Specs: Genuine OEM part, high-impact resistant plastic, finish: primed for painting, dimensions: tailored for optimal fit.  
Fitment Details: Direct replacement for the rear bumper of 2013 Honda Pilot models; ensure compatibility with specific trim levels.  
Notable Features: Designed for easy installation with pre-drilled holes for alignment, enhances aesthetic appeal while providing structural integrity and protection for the vehicle."
71501-TLA-A00,"Part Number: 71501-TLA-A00  
Name: FACE RR BPR LWR  
Application: Honda Accord, CR-V, S2000 (2011)  
Condition: New  
Technical Specs: Genuine OEM part, constructed for precise fit and durability, ensuring optimal performance.  
Fitment Details: Compatible with 2011 models of Honda Accord, CR-V, and S2000; designed for seamless installation.  
Notable Features: Original equipment quality, maintains manufacturer's specifications, enhances vehicle aesthetics and performance."
71501-TLA-A70,"Part Number: 71501-TLA-A70  
Name: FACE RR BPR LWR  
Application: Honda Element, Fit, Pilot, Ridgeline, S2000 (2015-2018)  
Condition: New  
Technical Specs: Genuine OEM part, precise fitment, durable construction, UV-resistant material  
Fitment Details: Designed for rear bumper applications specific to Honda models listed.  
Notable Features: This part is an original equipment manufacturer component, ensuring optimal performance and longevity, and is packaged in its original OEM box for authenticity."
71502-T1W-A00,"Part Number: 71502-T1W-A00  
Name: FACE R RR BUMPER  
Application: Honda Civic, 2023  
Condition: New  
Technical Specs: OEM genuine part, high-quality plastic construction, designed for optimal impact resistance.  
Fitment Details: Compatible with Honda Civic models from the year 2023, designed to fit precisely for seamless assembly.  
Notable Features: Engineered for superior durability and aesthetic appeal, featuring factory-matched color and finish to ensure a perfect blend with the vehicle's design."
71502-TBA-A00,"Part Number: 71502-TBA-A00  
Name: GARN RR BPR LWR  
Application: Honda Element, 2013  
Condition: New  
Technical Specs: Genuine OEM part, designed for optimal performance, material composition ensures durability and corrosion resistance.  
Fitment Details: Specifically engineered to fit the rear bumper lower section of the 2013 Honda Element; compatibility with factory components guaranteed.  
Notable Features: Features precise manufacturing for hassle-free installation and enhanced vehicle aesthetics, ensuring original quality and fitment in your Honda Element."
71503-TBA-A00,"Part Number: 71503-TBA-A00  
Name: GARN R RR BPR SID  
Application: Honda S2000 (2013-2019)  
Condition: New  
Technical Specs: Genuine OEM part, designed for precise fit and function.  
Fitment Details: Suitable for all models of the Honda S2000 produced between 2013 and 2019, ensuring compatibility with factory specifications.  
Notable Features: Manufactured to high OEM standards, ensuring durability and reliability; features original packaging for authenticity and quality assurance."
71505-TBA-A00,"Part Number: 71505-TBA-A00  
Name: BRKT R RR BPR SID  
Application: Honda Crosstour (2011-2012), Element (2011-2012), Odyssey (2011-2012)  
Condition: New  
Technical Specs: OEM, genuine part, meticulously molded design for durability  
Fitment Details: Designed for rear right bracket support on specified Honda models  
Notable Features: Ensures proper installation with original factory specifications, enhances vehicle structural integrity, and supports essential body components."
71507-T1W-A00,"Part Number: 71507-T1W-A00  
Name: FACE L RR BUMPER  
Application: Honda Civic, Odyssey, Pilot (2012)  
Condition: New  
Technical Specs: Genuine OEM part; made of durable plastic; painted surface compatible with factory color codes.  
Fitment Details: Designed to fit the left rear side of specified models from the 2012 production year.  
Notable Features: Original equipment design ensures perfect fit and finish; engineered to meet Honda's rigorous quality standards for optimal performance and durability.  

**Quantity Available: 2**  
**Price: $75.74**  "
