part_number,description
04301-RNA-307,"Part Number: 04301-RNA-307  
Name: P/S BELT  
Application: Honda CR-Z, HR-V (2020)  
Condition: New  
Technical Specs: OEM specification; made of high-strength EPDM rubber for durability; measures [specify dimensions if available].  
Fitment Details: Designed for precise fitment on Honda CR-Z and HR-V models of the year 2020.  
Notable Features: Features excellent resistance to wear and heat, ensuring optimal power steering performance and longevity."
04711-3A0-A00ZZ,"Part Number: 04711-3A0-A00ZZ  
Name: FACE FR BUMPER  
Application: Honda Pilot (2010-2019)  
Condition: New  
Technical Specs: Genuine OEM part, designed for optimal fit, made from high-quality materials for durability.  
Fitment Details: Direct replacement for all Honda Pilot models within the specified year range; ensures seamless integration with existing hardware.  
Notable Features: Engineered to meet or exceed factory standards; includes factory pre-drilled mounting points for easy installation."
04711-T0A-A90ZZ,"Part Number: 04711-T0A-A90ZZ  
Name: FACE FR BPR(DOT)  
Application: Honda Crosstour, Element, HR-V, Insight, Pilot (2018)  
Condition: New  
Technical Specs: OEM quality, genuine Honda part, designed for durability and optimal performance.  
Fitment Details: Direct fit for specified Honda models of the year 2018; replaces worn or damaged front bumper face.  
Notable Features: Engineered for perfect alignment and integration, ensuring seamless installation and enhanced vehicle aesthetics."
04711-T1W-A91ZZ,"Part Number: 04711-T1W-A91ZZ  
Name: FACE FR (DOT)  
Application: Honda Insight, 2018  
Condition: New  
Technical Specs: Genuine OEM part, designed for optimal fit and finish, made from high-quality materials.  
Fitment Details: Compatible with 2018 Honda Insight models; fits standard factory specifications.  
Notable Features: Ensures structural integrity and aesthetics, meeting DOT regulations for safety and performance; comes in original packaging."
04711-T20-A00ZZ,"Part Number: 04711-T20-A00ZZ  
Name: FACE FR BUMPER  
Application: Honda Crosstour (2018, 2019, 2020, 2021)  
Condition: New  
Technical Specs: OEM, designed for precise fitment, made from durable materials for enhanced impact resistance.  
Fitment Details: Designed specifically for 2018-2021 Honda Crosstour models; ensures correct alignment and function with factory components.  
Notable Features: Original equipment part, provides a seamless aesthetic and integrated safety features typical of Honda design."
04711-T7W-A80ZZ,"Part Number: 04711-T7W-A80ZZ  
Name: FACE FR (DOT)  
Application: Honda Clarity (2013-2021)  
Condition: New  
Technical Specs: Genuine OEM Part; Designed for optimal fit and function; Original packaging included.  
Fitment Details: Specifically engineered for Honda Clarity models produced from 2013 to 2021, ensuring compatibility and reliability.  
Notable Features: Features high-quality DOT compliance; crafted for durability and performance; meets OEM specifications for enhanced reliability."
04711-TBA-A00ZZ,"Part Number: 04711-TBA-A00ZZ  
Name: FACE FR BUMPER  
Application: Honda Civic, 2022  
Condition: New  
Technical Specs: Genuine OEM part, lightweight plastic construction, designed to meet original equipment specifications.  
Fitment Details: Fits Honda Civic models manufactured in 2022; ensure proper alignment with existing mounting points.  
Notable Features: Designed for optimal aerodynamics and aesthetics; includes provisions for fog lights and impact absorption for enhanced safety."
04711-TBA-A50ZZ,"Part Number: 04711-TBA-A50ZZ  
Name: FACE FR BUMPER  
Application: Honda Ridgeline, 2022-2023  
Condition: New  
Technical Specs: Genuine OEM part; dimensions and fit engineered specifically for the Ridgeline; lightweight yet durable construction.  
Fitment Details: Designed to fit seamlessly with the front assembly of 2022 and 2023 Honda Ridgeline models.  
Notable Features: Factory finish; designed for optimal aerodynamics and aesthetics; enhances front-end protection and vehicle styling."
04711-TG7-A50ZZ,"Part Number: 04711-TG7-A50ZZ  
Name: FACE FR BUMPER  
Application: Honda CR-Z (2011), Odyssey (2011), S2000 (2011)  
Condition: New  
Technical Specs: Genuine OEM, constructed from durable plastic, designed for optimal fitment and impact resistance.  
Fitment Details: Directly replaces the factory bumper for specified models, ensuring precise alignment with mounting points.  
Notable Features: Original packaging, pre-painted finish compatible with factory color codes, offers improved aerodynamics and frontal aesthetics. "
04711-TGG-A00ZZ,"Part Number: 04711-TGG-A00ZZ  
Name: FACE FR BUMPER  
Application: Honda Pilot, 2019 - 2023  
Condition: New  
Technical Specs: OEM genuine part, polypropylene construction, painted finish.  
Fitment Details: Designed for Honda Pilot models from 2019 to 2023; ensures proper alignment and fitting to factory specifications.  
Notable Features: Durable design for enhanced impact resistance, retains factory aesthetics, and comes in original packaging.  

This front bumper face provides seamless integration and enhances vehicle appearance while maintaining OEM quality standards."
04711-THR-A00ZZ,"Part Number: 04711-THR-A00ZZ  
Name: FACE FR BUMPER  
Application: Honda S2000 (2021)  
Condition: New  
Technical Specs: Genuine OEM part, unpainted, made of high-impact plastic for enhanced durability, designed to meet manufacturer specifications.  
Fitment Details: Designed specifically for 2021 Honda S2000 models, ensuring a precise fitment without modifications.  
Notable Features: Original equipment quality, retains factory styling for seamless integration with your vehicle’s aesthetic, and includes all necessary mounting points for easy installation."
04711-TLA-A00ZZ,"Part Number: 04711-TLA-A00ZZ  
Name: FACE FR BUMPER  
Application: Honda Crosstour, Ridgeline (2010)  
Condition: New  
Technical Specs: OEM specifications; designed for optimal fit and durability; manufactured with high-quality materials.  
Fitment Details: Engineered to seamlessly fit 2010 Honda Crosstour and Ridgeline models; includes necessary mounting points.  
Notable Features: Genuine Honda OEM part ensuring quality and reliability; available in original packaging; steeply discounted price."
04711-TLA-A50ZZ,"Part Number: 04711-TLA-A50ZZ  
Name: FACE FR BUMPER  
Application: Honda CR-Z (2015-2016)  
Condition: New  
Technical Specs: Genuine OEM part, designed for optimal fit and durability, material: polypropylene, unpainted finish.  
Fitment Details: Direct fit for Honda CR-Z models from 2015 to 2016; replaces old or damaged front bumper assembly.  
Notable Features: Engineered for precise alignment with vehicle body for enhanced aesthetics and protection, designed to accommodate factory lights and emblem."
04711-TR3-A50ZZ,"Part Number: 04711-TR3-A50ZZ  
Name: FACE FR BUMPER  
Application: Honda HR-V, 2017-2019  
Condition: New  
Technical Specs: Genuine OEM part, molded plastic construction, factory finish  
Fitment Details: Designed to fit Honda HR-V models from 2017 to 2019 without modification  
Notable Features: Provides an exact factory fit and finish for optimal aesthetics and performance; designed for safety and structural integrity in the event of a collision."
04712-T0A-A90,"Part Number: 04712-T0A-A90  
Name: FACE FR BUMPER  
Application: Honda CR-Z, Element, Insight, Passport, Ridgeline (2021)  
Condition: New  
Technical Specs: Made of durable polypropylene; OEM design for perfect fitment; painted and prepped for easy installation.  
Fitment Details: Direct fit for 2021 Honda models listed; replaces old or damaged front bumper seamlessly.  
Notable Features: Genuine OEM part ensures quality and reliability; enhances vehicle aesthetics and safety with optimal impact resistance."
04712-T1W-A91,"Part Number: 04712-T1W-A91  
Name: FACE FR (DOT)  
Application: Honda Crosstour, Years 2018-2023  
Condition: New  
Technical Specs: Genuine OEM part, manufactured with high-strength materials, designed for optimal fitment and durability.  
Fitment Details: Specifically engineered to align seamlessly with the Honda Crosstour, ensuring precise installation and function for models from 2018 to 2023.  
Notable Features: Original packaging, steeply discounted pricing, guarantees reliable performance and compliance with safety standards."
04712-TLA-A00ZZ,"Part Number: 04712-TLA-A00ZZ  
Name: FACE R RR BPR  
Application: Honda Passport, S2000 (2015-2020)  
Condition: New  
Technical Specs: Genuine OEM part, designed for durability and performance, crafted to precise manufacturer specifications.  
Fitment Details: Specifically fits Honda Passport and S2000 models, ensuring optimal compatibility across specified years.  
Notable Features: Made from high-quality materials for enhanced reliability, retains original factory specifications, and comes in original packaging for authenticity."
04715-SNA-A90ZZ,"Part Number: 04715-SNA-A90ZZ  
Name: FACE RR BPR(DOT)  
Application: Honda Accord, CR-Z, Crosstour, Element, Ridgeline (2021)  
Condition: New  
Technical Specs: Genuine OEM part, high-quality materials, designed for enhanced durability and performance.  
Fitment Details: Directly fits 2021 models of Honda Accord, CR-Z, Crosstour, Element, and Ridgeline with no modifications required.  
Notable Features: Engineered for precise fit and optimal aesthetic appeal, ensuring compliance with DOT safety standards."
04715-T0A-A90,"Part Number: 04715-T0A-A90  
Name: FACE RR BPR LWR(D  
Application: Honda Clarity, Insight, Passport (2019-2022)  
Condition: New  
Technical Specs: OEM genuine part; designed for rear bumper integration; high-quality material construction for durability.  
Fitment Details: Compatible with Honda Clarity, Insight, and Passport models from 2019 to 2022; specific to lower rear bumper section (Driver’s side).  
Notable Features: Engineered to meet OEM specifications for perfect fit; enhances vehicle aesthetics while maintaining structural integrity."
04715-T1W-A91ZZ,"Part Number: 04715-T1W-A91ZZ  
Name: FACE RR (DOT)  
Application: Honda Civic, Insight, Ridgeline (2022)  
Condition: New  
Technical Specs: Genuine OEM part, designed for optimal performance and durability.  
Fitment Details: Specifically engineered for 2022 Honda models, ensuring a precise fit and seamless integration.  
Notable Features: This genuine part meets stringent Honda manufacturing standards, ensuring quality and reliability for enhanced vehicle performance. 

**Note:** Currently out of stock."
04715-T20-A00ZZ,"Part Number: 04715-T20-A00ZZ  
Name: FACE RR BUMPER  
Application: Honda Clarity, Ridgeline (2019)  
Condition: New  
Technical Specs: Genuine OEM part, durable plastic construction, factory specifications.  
Fitment Details: Designed to fit the rear end of 2019 Honda Clarity and Ridgeline models without modifications.  
Notable Features: Engineered for precise fitment, superior finish, and integration with vehicle’s safety systems. Ideal for replacements or upgrades.  

Quantity available: 2.  
Price: $456.93 each.  "
04715-T7W-A90,"Part Number: 04715-T7W-A90  
Name: FACE RR (DOT)  
Application: Honda HR-V (2017-2021)  
Condition: New  
Technical Specs: Genuine OEM part, designed for proper fit and finish, constructed with high-quality materials for durability.  
Fitment Details: Specifically engineered for Honda HR-V models manufactured from 2017 to 2021, ensuring seamless integration and performance.  
Notable Features: This rear face component complies with DOT standards for safety, providing excellent aesthetics and functionality tailored for the HR-V."
04715-TBA-A00ZZ,"Part Number: 04715-TBA-A00ZZ  
Name: FACE RR BUMPER  
Application: Honda Insight, Passport (2016, 2017)  
Condition: New  
Technical Specs: Genuine OEM part, designed to meet strict quality standards, ABS plastic construction for durability, dimensions tailored for optimal fit.  
Fitment Details: Direct replacement for specified models; ensures seamless integration with existing vehicle structure.  
Notable Features: Designed to enhance vehicle aesthetics while providing necessary protection; original packaging ensures authenticity."
04715-TK8-A80ZZ,"Part Number: 04715-TK8-A80ZZ  
Name: FACE RR BPR(DOT)  
Application: Honda Odyssey (2016-2020)  
Condition: New  
Technical Specs: Genuine OEM part; designed for optimal fit and performance; manufactured to strict quality standards.  
Fitment Details: Compatible with all Honda Odyssey models from 2016 through 2020; directly replaces original part.  
Notable Features: Enhanced durability and reliability; finished in original factory specifications to ensure seamless integration with existing vehicle components."
04715-TK8-A90ZZ,"Part Number: 04715-TK8-A90ZZ  
Name: FACE RR BPR(DOT)  
Application: Honda Odyssey 2017  
Condition: New  
Technical Specs: Genuine OEM part, designed for rear bumper application, DOT approved.  
Fitment Details: Specifically engineered for 2017 Honda Odyssey models; ensures exact fit and compatibility.  
Notable Features: Original equipment quality, maintains factory specifications, enhances vehicle aesthetics and functionality."
04715-TR3-A50ZZ,"Part Number: 04715-TR3-A50ZZ  
Name: FACE RR BUMPER  
Application: Honda CR-Z, Passport, Ridgeline, S2000 (2010)  
Condition: New  
Technical Specs: OEM genuine part, high-quality plastic construction, painted finish  
Fitment Details: Direct replacement for models listed; ensures factory fit and seamless integration  
Notable Features: Designed for optimal aerodynamics and impact resistance; enhances vehicle aesthetics and value.  

This part is part of our inventory of steeply discounted genuine OEM components, ensuring quality and longevity."
04717-TLA-A00ZZ,"Part Number: 04717-TLA-A00ZZ  
Name: FACE L RR BPR  
Application: Honda Fit, 2012-2017  
Condition: New  
Technical Specs: OEM genuine part, factory-manufactured, original packaging  
Fitment Details: Designed specifically for the left rear bumper of Honda Fit models from 2012 to 2017; ensures exact fitment with factory specifications.  
Notable Features: Durable construction for enhanced durability, seamless integration with existing bodywork, and painted finish compatible with Honda's original color codes for optimal aesthetics."
04770-S5A-405,"Part Number: 04770-S5A-405  
Name: DAB INFLATOR  
Application: Honda Crosstour, 2011  
Condition: New  
Technical Specs: OEM part, designed for precision fit and optimal performance; includes integrated inflator mechanism.  
Fitment Details: Compatible exclusively with the 2011 Honda Crosstour to ensure seamless integration and safety functionality.  
Notable Features: Genuine OEM quality guarantees reliability and safety; original packaging ensures parts integrity.  

This DAB INFLATOR provides essential airbag deployment capabilities, engineered to meet strict Honda specifications for your vehicle."
04790-S5A-A00,"Part Number: 04790-S5A-A00  
Name: PAB INFLATOR  
Application: Honda CR-Z, Civic, Crosstour, Element (2020)  
Condition: New  
Technical Specs: Genuine OEM part; designed for optimal deployment in the event of a collision.  
Fitment Details: Direct fit for the specified Honda models; ensures proper integration with vehicle safety systems.  
Notable Features: Engineered for reliability and performance; enhances passenger safety with precision-engineered inflator technology. Perfect for replacements needing exact OEM standards.  
Quantity Available: 2  
Price: $128.75 each  "
04790-SNA-A00,"Part Number: 04790-SNA-A00  
Name: PAB INFLATOR  
Application: Honda CR-V (2023)  
Condition: New  
Technical Specs: OEM quality, inflator design for passenger airbag system; ensures optimal deployment and safety.  
Fitment Details: Direct fit for 2023 Honda CR-V; replaces factory-installed part.  
Notable Features: Genuine Honda part, engineered for precise compatibility and reliable performance, ensures maximum safety in the event of a collision."
04790-SWA-A00,"Part Number: 04790-SWA-A00  
Name: PAB INFLATOR  
Application: Honda Odyssey, 2010-2012  
Condition: New  
Technical Specs: Inflator unit designed for supplemental restraint system (SRS); meets OEM standards for performance and safety.  
Fitment Details: Specifically engineered for Honda Odyssey models from 2010 to 2012; direct replacement for failed or deployed inflators.  
Notable Features: Genuine OEM part ensures compatibility and reliability; packaged in original packaging for assured quality."
04818-TBA-A02ZA,"Part Number: 04818-TBA-A02ZA  
Name: OUTER SET L FR SE  
Application: Honda Accord, CR-Z, Crosstour, Fit, S2000 (2011-2014)  
Condition: New  
Technical Specs: Genuine OEM part, manufactured to exact specifications for optimal performance.  
Fitment Details: Compatible with specified Honda models within the stated years, ensuring precise fitment and functionality.  
Notable Features: Original packaging and designation as a genuine part provide assurance of quality and reliability. Ideal for replacement to maintain vehicle integrity and performance meets OEM standards."
06160-5PA-305,"Part Number: 06160-5PA-305  
Name: KIT FUEL INJECTOR  
Application: Honda Civic (2014-2021)  
Condition: New  
Technical Specs: Genuine OEM component, multi-port fuel injector, high-precision delivery.  
Fitment Details: Designed specifically for Honda Civic models across specified years, ensuring optimal engine performance and fuel efficiency.  
Notable Features: Engineered to meet or exceed original equipment specifications, includes all necessary installation components for direct replacement."
06160-RLV-305,"Part Number: 06160-RLV-305  
Name: F INJ KIT  
Application: Honda Civic, Element, Insight, Odyssey (2019-2022)  
Condition: New  
Technical Specs: Genuine OEM fuel injector kit, includes necessary components for installation, optimized for performance and fuel efficiency.  
Fitment Details: Compatible with 2019-2022 Honda Civic, Element, Insight, and Odyssey models.  
Notable Features: Ensures precise fuel delivery, designed for original factory specifications, enhances engine performance and reliability."
06237-5J4-010,"Part Number: 06237-5J4-010  
Name: SCREW PLUG OIL  
Application: Honda Element, 2013  
Condition: New  
Technical Specs: Material: Steel, Finish: Zinc-Coated, Thread Diameter: Specified OEM standard  
Fitment Details: Designed specifically for the oil pan of the 2013 Honda Element, ensuring a precise fit.  
Notable Features: Genuine OEM part for guaranteed compatibility, offers superior sealing and durability compared to aftermarket alternatives. "
06730-SJC-315,"Part Number: 06730-SJC-315  
Name: KIT SUBFRM XBAR  
Application: Honda HR-V, 2013-2019  
Condition: New  
Technical Specs: Genuine OEM part; original packaging; high-strength material for structural integrity.  
Fitment Details: Compatible with HR-V models from 2013 through 2019, ensuring proper alignment and performance.  
Notable Features: Engineered for durability and precision fit to maintain suspension alignment and enhance handling characteristics."
06730-SWA-325,"Part Number: 06730-SWA-325  
Name: KIT TRG ARM HLDR  
Application: Honda Accord, CR-V, Fit, Ridgeline (2015)  
Condition: New  
Technical Specs: Genuine OEM kit, manufactured to exact specifications, designed for durability and reliability.  
Fitment Details: Compatible with Honda models from the 2015 year range; ensures proper installation and function in specified models.  
Notable Features: Includes all necessary components for installation and is packaged in original OEM box, guaranteeing quality and authenticity."
08200-9003C,"Part Number: 08200-9003C  
Name: VTM-4 DIFF FLUID  
Application: Honda Crosstour, Pilot, Ridgeline (2017-2019)  
Condition: New  
Technical Specs: 1-quart bottle, compliant with Honda VTM-4 specifications, synthetic blend for optimal performance.  
Fitment Details: Suitable for vehicles equipped with Variable Torque Management 4WD systems.  
Notable Features: Enhances differential lubrication, reducing friction and wear, improving overall drivetrain efficiency and performance in various driving conditions."
08200-9007C,"Part Number: 08200-9007C  
Name: DPF II FLUID  
Application: Honda Crosstour, 2017-2018  
Condition: New  
Technical Specs: 1L container, formulated for Diesel Particulate Filter (DPF) regeneration, complies with OEM standards.  
Fitment Details: Specifically designed for 2017-2018 Honda Crosstour models equipped with diesel engines featuring DPF systems.  
Notable Features: Genuine OEM part ensures optimal performance and compatibility, enhancing emissions control and maintaining diesel engine efficiency."
08200-HCF2C,"Part Number: 08200-HCF2C  
Name: HCF2 FLUID  
Application: Honda Civic, Crosstour, Element, S2000 (2020-2023)  
Condition: New  
Technical Specs: 1-quart container, OEM formulation, suitable for high-performance applications  
Fitment Details: Specifically designed for Honda models listed; optimizes transmission performance and longevity  
Notable Features: Genuine Honda part, providing superior lubrication and protection, ensuring compliance with manufacturer's specifications for optimal function."
08206-9002C,"Part Number: 08206-9002C  
Name: P S FLUID""S""350ML  
Application: Honda CR-Z, Crosstour, Fit, Pilot (2013)  
Condition: New  
Technical Specs: Capacity: 350ML; OEM Specification  
Fitment Details: Compatible with 2013 models of Honda CR-Z, Crosstour, Fit, and Pilot; ensures optimal power steering performance.  
Notable Features: Genuine OEM part, formulated to meet Honda's strict quality standards for fluid protection and performance."
08700-CBC00,"Part Number: 08700-CBC00  
Name: CONT/BRKE CLEANER  
Application: Honda CR-Z (2014-2016), Civic (2014-2016), Fit (2014-2016), S2000 (2014-2016)  
Condition: New  
Technical Specs: 13.5 oz aerosol can, non-chlorinated formula, fast-drying, residue-free cleaning  
Fitment Details: Designed specifically for Honda vehicles, compatible with disc and drum brakes  
Notable Features: Effectively removes brake dust, grease, and contaminants, ensuring optimal braking performance and safety."
08700-WLG00,"Part Number: 08700-WLG00  
Name: WHITE LITH GREASE  
Application: Honda Civic, HR-V, Passport (2015)  
Condition: New  
Technical Specs: High-performance white lithium grease, multi-purpose application, temperature range -20°C to 130°C.  
Fitment Details: Suitable for various pivot points and sliding mechanisms in Honda vehicles.  
Notable Features: Excellent water resistance, prevents rust and corrosion, provides long-lasting lubrication, comes in original packaging."
08718-0004,"Part Number: 08718-0004  
Name: HONDABOND HT  
Application: Honda CR-V (2021-2023), HR-V (2021-2023), Insight (2021-2023), Ridgeline (2021-2023)  
Condition: New  
Technical Specs: High-performance liquid gasket, resistances to fuel, oil, and temperature extremes up to 300°F (149°C).  
Fitment Details: Designed for reliable sealing on various engine and transmission components.  
Notable Features: Fast-curing formula provides excellent adhesion and durability, preventing leaks and ensuring optimal engine performance."
08798-9008C,"Part Number: 08798-9008C  
Name: BRAKE FLUID DOT 3  
Application: Honda Ridgeline (2020, 2021, 2022, 2023)  
Condition: New  
Technical Specs: DOT 3 specification, synthetic composition, 500 mL volume  
Fitment Details: Specifically designed for Honda Ridgeline models from 2020 to 2023; use for hydraulic braking systems.  
Notable Features: Ensures optimal braking performance, corrosion resistance, and moisture absorption prevention, meeting stringent Honda quality standards."
08798-9031C,"Part Number: 08798-9031C  
Name: MTF 1 LITRE  
Application: Honda Crosstour, Odyssey (2015-2022)  
Condition: New  
Technical Specs: 1 Litre capacity, Genuine OEM part, viscosity suitable for optimal transmission performance.  
Fitment Details: Designed for direct compatibility with Honda models: Crosstour (2015-2022) and Odyssey (2015-2022).  
Notable Features: Provides superior lubrication and friction control, enhancing the longevity and efficiency of transmission components."
08DEF-410746,"Part Number: 08DEF-410746  
Name: INLINE HEATER 700  
Application: Honda CR-V, Civic, Crosstour, Odyssey (2021)  
Condition: New  
Technical Specs: Designed for optimal heating efficiency, compatible with Honda's innovative cooling systems, meets OEM standards.  
Fitment Details: Direct fit for specified Honda models, ensuring seamless integration with existing heating systems.  
Notable Features: Enhances automotive heating performance, aids in engine warm-up, and improves cabin comfort during cold weather, packaged in original OEM box."
08DEF-461007,"Part Number: 08DEF-461007  
Name: CORD 1 5 & 2 5 PR  
Application: Honda Civic, 2013-2017  
Condition: New  
Technical Specs: OEM part, designed for high durability and reliability, capable of handling the vehicle’s electrical load.  
Fitment Details: Compatible with all Honda Civic models within the specified year range, ensuring proper integration into the vehicle's systems.  
Notable Features: Genuine Honda OEM part guarantees quality craftsmanship and precise fitment, contributing to optimal vehicle performance.  

"
08P09-30A-300,"Part Number: 08P09-30A-300  
Name: RR SPLASH GUARD  
Application: Honda Element, Pilot, S2000 (2015-2018)  
Condition: New  
Technical Specs: Made from high-quality durable materials, designed to absorb water and debris, ensuring optimal vehicle performance.  
Fitment Details: Fits rear underbody areas for the specified Honda models, enhancing aerodynamics and protecting against road spray.  
Notable Features: Genuine OEM part, precision-engineered for perfect fit and finish, reduces splash and minimizes corrosion risk."
